{
  "api_version": "1",
  "request_id": "req_redundant_start_01",
  "connection": {
    "lease_id": "20000000-0000-4000-8000-000000000002",
    "pool_id": "7",
    "layer": "stray",
    "transport_protocol": "amneziawg_3",
    "tic_connection_mode": "dynamic",
    "route_mode": "standalone",
    "egress_mode": "ipv4",
    "status": "issued",
    "pinned": false,
    "stopped_at": null
  },
  "configuration": "[Interface]\nPrivateKey = primary-delivered-only-to-core\nAddress = 10.200.0.2/32\n",
  "health_probe": {
    "kind": "dns_a",
    "target_ipv4": "8.8.8.8",
    "query_name": "nelomai.ru",
    "timeout_ms": 4000
  },
  "reused": false,
  "redundancy": {
    "session_id": "20000000-0000-4000-8000-000000000001",
    "state": "warming",
    "role_generation": 0,
    "membership_generation": 0,
    "virtual_address_v4": "10.200.0.2/32",
    "standby_desired": true,
    "reason": null,
    "standby": {
      "health": "warming",
      "connection": {
        "lease_id": "20000000-0000-4000-8000-000000000003",
        "pool_id": "8",
        "layer": "stray",
        "transport_protocol": "amneziawg_3",
        "tic_connection_mode": "dynamic",
        "route_mode": "standalone",
        "egress_mode": "ipv4",
        "status": "issued",
        "pinned": false,
        "stopped_at": null
      },
      "configuration": "[Interface]\nPrivateKey = standby-delivered-only-to-core\nAddress = 10.200.0.2/32\n",
      "health_probe": {
        "kind": "dns_a",
        "target_ipv4": "8.8.8.8",
        "query_name": "nelomai.ru",
        "timeout_ms": 4000
      }
    }
  }
}
